12/01/2018 03:42,,,
Código,Descrição,Início de Vigência,Fim de Vigência
0000151,REPAROS NAVAIS,01/12/1992,-
0101101,"CAVALOS DE ""PEDIGREE""",01/12/1992,-
0101191,CAVALOS PARA CORRIDA,01/12/1992,-
0101192,CAVALOS PARA POLO,01/12/1992,-
0101193,CAVALOS PARA REPRODUCAO,01/12/1992,-
0101194,CAVALOS PARA TRABALHO,01/12/1992,-
0101199,OS DEMAIS CAVALOS,01/12/1992,-
0101201,ASNOS DE PEDRIGREE,01/12/1992,-
0101299,"OS DEMAIS ASNOS, SEM PEDIGREE",01/12/1992,-
0101301,MULOS,01/12/1992,-
0102101,VACUNS REPRODUTORES DE PEDIGREE,01/12/1992,-
0102109,OS DEMAIS VACUNS DE PEDIGREE,01/12/1992,-
0102111,BEZERROS E VITELAS PUROS POR CRUZA,01/12/1992,-
0102119,OS DEMAIS VACUNS PUROS POR CRUZA,01/12/1992,-
0102191,AS DEMAIS BEZERRAS E VITELAS,01/12/1992,-
0102192,OS DEMAIS VACUNS PARA CONSUMO,01/12/1992,-
0102199,OS DEMAIS VACUNS,01/12/1992,-
0102901,"BUFALOS, EXCETO REPRODUTORES DE RACA PURA",01/12/1992,-
0102902,BUFALOS REPRODUTORES DE RACA PURA,01/12/1992,-
0102999,OS DEMAIS ANIMAIS VIVOS DA ESPECIE BOVINA,01/12/1992,-
0103101,"SUINOS DE ""PEDIGREE""",01/12/1992,-
0103199,OS DEMAIS SUINOS,01/12/1992,-
0103901,JAVALIS,01/12/1992,-
0103999,OS DEMAIS ANIMAIS VIVOS DA ESPECIE SUINA,01/12/1992,-
0104101,"OVINOS DE ""PEDIGREE""",01/12/1992,-
0104111,OVINOS PUROS POR CRUZA,01/12/1992,-
0104121,OVINOS (CAPOES),01/12/1992,-
0104199,OS DEMAIS OVINOS,01/12/1992,-
0104201,"CAPRINOS DE ""PEDIGREE""",01/12/1992,-
0104299,OS DEMAIS CAPRINOS SEM PEDIGREE,01/12/1992,-
0105101,"PINTOS CHAMADOS DE ""UM DIA"", DE ""PEDIGREE""",01/12/1992,-
0105102,"GALINHAS DE ""PEDIGREE""",01/12/1992,-
0105109,"GALOS DE ""PEDIGREE""",01/12/1992,-
0105191,AS DEMAIS GALINHAS,01/12/1992,-
0105192,"OS DEMAIS PINTOS CHAMADOS DE ""UM DIA""",01/12/1992,-
0105199,OS DEMAIS GALOS,01/12/1992,-
0105201,"PINTOS CHAMADOS DE ""UM DIA"" (PATOS), DE ""PED",01/12/1992,-
0105202,"PATOS DE ""PEDIGREE""",01/12/1992,-
0105291,OS DEMAIS PATOS,01/12/1992,-
0105292,"OS DEMAIS PINTOS CHAMADOS DE ""UM DIA"" (PATOS",01/12/1992,-
0105301,"PINTOS CHAMADOS DE ""UM DIA"" (PERUS), DE ""PED",01/12/1992,-
0105302,"PERUS DE ""PEDIGREE""",01/12/1992,-
0105391,OS DEMAIS PERUS,01/12/1992,-
0105392,"OS DEMAIS PINTOS CHAMADOS DE ""UM DIA"" (PERUS",01/12/1992,-
0105901,GANSOS,01/12/1992,-
0105902,"PINTOS CHAMADOS DE ""UM DIA"" (GANSOS)",01/12/1992,-
0105999,AS DEMAIS AVES DOMESTICAS VIVAS,01/12/1992,-
0106101,"COELHOS DE ""PEDIGREE""",01/12/1992,-
0106199,OS DEMAIS COELHOS,01/12/1992,-
0106201,"AVES (NAO COMPREENDIDAS NA POSICAO 01.05), D",01/12/1992,-
0106211,POMBO CORREIO,01/12/1992,-
0106219,OS DEMAIS POMBOS,01/12/1992,-
0106291,AS DEMAIS AVES VIVAS UTILIZADAS PRINCIPALMEN,01/12/1992,-
0106299,AS DEMAIS AVES VIVAS PARA OUTROS FINS,01/12/1992,-
0106301,ANIMAIS VIVOS PARA CIRCOS E PARQUES ZOOLOGIC,01/12/1992,-
0106401,CAES DOMESTICOS,01/12/1992,-
0106499,OS DEMAIS ANIMAIS DOMESTICOS,01/12/1992,-
0106501,"NUTRIAS, PARA PELETERIA",01/12/1992,-
0106502,"""VISONS"", PARA PELETERIA",01/12/1992,-
0106599,"OS DEMAIS ANIMAIS VIVOS, PARA PELETERIA",01/12/1992,-
0106901,ABELHAS-MESTRAS,01/12/1992,-
0106909,OS DEMAIS INSETOS,01/12/1992,-
0106991,OS DEMAIS ANIMAIS VIVOS DAS ESPECIES UTILIZA,01/12/1992,-
0106999,OS DEMAIS OUTROS ANIMAIS VIVOS,01/12/1992,-
0201101,"CARNE DE VACUM FRESCA OU REFRIGERADA, SEM DE",01/12/1992,-
0201102,"CARNE DE VACUM CONGELADA, SEM DESOSSAR",01/12/1992,-
0201103,"CARNE DE VACUN FRESCA OU REFRIGERADA, DESOSS",01/12/1992,-
0201104,"CARNE DE VACUM CONGELADA, DESOSSADA",01/12/1992,-
0201111,CARNE DE OVINO FRESCA OU REFRIGERADA,01/12/1992,-
0201112,CARNE DE OVINO CONGELADA,01/12/1992,-
0201121,CARNE DE CAPRINO FRESCA OU REFRIGERADA,01/12/1992,-
0201122,CARNE DE CAPRINO CONGELADA,01/12/1992,-
0201131,CARNE DE SUINO FRESCA OU REFRIGERADA,01/12/1992,-
0201132,CARNE DE SUINO CONGELADA,01/12/1992,-
0201133,TOUCINHO ENTREMEADO,01/12/1992,-
0201141,CARNE DE CAVALO,01/12/1992,-
0201191,CARNE DE ASNO,01/12/1992,-
0201199,AS DEMAIS CARNES COMESTIVEIS DOS ANIMAIS  CL,01/12/1992,-
0201201,"RABOS FRESCOS, REFRIGERADOS OU CONGELADOS",01/12/1992,-
0201202,"FIGADOS FRESCOS, REFRIGERADOS OU CONGELADOS",01/12/1992,-
0201203,"LINGUAS FRESCAS, REFRIGERADAS OU CONGELADAS",01/12/1992,-
0201299,OS DEMAIS MIUDOS COMESTIVEIS DOS ANIMAIS  CL,01/12/1992,-
0202001,"CARNES DE AVES DOMESTICAS MORTAS, FRESCAS, R",01/12/1992,-
0202002,MIUDOS DE AVES DOMESTICAS MORTAS (COM EXCLUS,01/12/1992,-
0203101,"FIGADOS DE GANSO FRESCOS, REFRIGERADOS OU CO",01/12/1992,-
0203199,"OS DEMAIS FIGADOS DE AVES, FRESCOS, REFRIGER",01/12/1992,-
0203201,FIGADOS DE GANSO SALGADOS OU EM SALMOURA,01/12/1992,-
0203299,OS DEMAIS FIGADOS DE AVES SALGADOS OU EM SAL,01/12/1992,-
0204101,"CARNE DE BALEIA FRESCA, REFRIGERADA OU CONGE",01/12/1992,-
0204102,"CARNE DE COELHO FRESCA, REFRIGERADA OU CONGE",01/12/1992,-
0204103,"CARNE DE TARTARUGA FRESCA, REFRIGERADA OU CO",01/12/1992,-
0204104,CARNE DE OURICOS DO MAR,01/12/1992,-
0204199,"AS DEMAIS CARNES COMESTIVEIS FRESCAS, REFRIG",01/12/1992,-
0204201,"FIGADOS FRESCOS, REFRIGERADOS OU CONGELADOS",01/12/1992,-
0204202,"LINGUAS FRESCAS, REFRIGERADAS OU CONGELADAS",01/12/1992,-
0204299,"OS DEMAIS MIUDOS COMESTIVEIS FRESCOS, REFRIG",01/12/1992,-
0205101,"TOUCINHO FRESCO, REFRIGERADO OU CONGELADO",01/12/1992,-
0205102,TOUCINHO SALGADO OU EM SALMOURA,01/12/1992,-
0205103,TOUCINHO SECO OU DEFUMADO,01/12/1992,-
0205201,"GORDURA DE PORCO FRESCA, REFRIGERADA OU CONG",01/12/1992,-
0205202,GORDURA DE PORCO SALGADA OU EM SALMOURA,01/12/1992,-
0205299,AS DEMAIS GORDURA DE PORCO NAO PRENSADAS NEM,01/12/1992,-
0205301,"GORDURA DE AVES DOMESTICAS FRESCA, REFRIGERA",01/12/1992,-
0205302,GORDURA DE AVES DOMESTICAS SALGADA OU EM SAL,01/12/1992,-
0205399,"AS DEMAIS GORDURAS DE AVES DOMESTICAS, NAO P",01/12/1992,-
0206101,"TOUCINHO ENTREMEADO, SALGADO OU EM SALMOURA,",01/12/1992,-
0206102,"PRESUNTOS SALGADOS OU EM SALMOURA, SECOS OU",01/12/1992,-
0206201,"CARNE DE PORCO SALGADA OU EM SALMOURA, SECA",01/12/1992,-
0206202,"CARNE DE VACUM SALGADA OU EM SALMOURA, SECA",01/12/1992,-
0206203,"CARNE DE OVINO SALGADA OU EM SALMOURA, SECA",01/12/1992,-
0206299,AS DEMAIS CARNES COMESTIVEIS DE QUALQUER ESP,01/12/1992,-
0206301,"LINGUAS DE PORCO, SALGADAS OU EM SALMOURA, S",01/12/1992,-
0206302,"LINGUAS DE VACUM, SALGADAS OU EM SALMOURA, S",01/12/1992,-
0206303,"LINGUAS DE OVINO, SALGADAS OU EM SALMOURA, S",01/12/1992,-
0206391,"OS DEMIAS MIUDOS DE PORCO, SALGADOS OU EM SA",01/12/1992,-
0206399,OS DEMAIS MIUDOS COMESTIVEIS DE QUALQUER ESP,01/12/1992,-
0301101,PEIXES VIVOS PARA REPRODUCAO OU CRIACAO INDU,01/12/1992,-
0301102,PEIXES VIVOS PARA ORNAMENTACAO,01/12/1992,-
0301199,OS DEMAIS PEIXES VIVOS,01/12/1992,-
0301201,"PEIXES MORTOS (EXCETO OS FILES), FRESCOS OU",01/12/1992,-
0301202,"PEIXES MORTOS (EXCETO OS FILES), CONGELADOS",01/12/1992,-
0301301,FILES DE PEIXE FRESCO OU REFRIGERADO,01/12/1992,-
0301401,FILES DE PEIXE CONGELADO,01/12/1992,-
0302001,PEIXES SALGADOS OU EM SALMOURA,01/12/1992,-
0302002,PEIXES SECOS,01/12/1992,-
0302003,PEIXES DEFUMADOS,01/12/1992,-
0302004,FARINHA DE PEIXE PROPRIA PARA A ALIMENTACAO,01/12/1992,-
0302005,"BACALHAU (EXCETO OS FILES) SECO, SALGADO",01/12/1992,-
0303101,LAGOSTAS FRESCAS OU REFRIGERADAS,01/12/1992,-
0303102,LAGOSTINS FRESCOS OU REFRIGERADOS,01/12/1992,-
0303103,CAMAROES FRESCOS OU REFRIGERADOS,01/12/1992,-
0303104,CENTOLAS FRESCOS OU REFRIGERADOS,01/12/1992,-
0303105,"""LOCOS"" FRESCOS OU REFRIGERADOS",01/12/1992,-
0303106,CARACOIS FRESCOS OU REFRIGERADOS,01/12/1992,-
0303199,OS DEMAIS CRUSTACEOS E MOLUSCOS (MESMO SEPAR,01/12/1992,-
0303201,LAGOSTAS CONGELADAS,01/12/1992,-
0303202,LAGOSTINS CONGELADOS,01/12/1992,-
0303203,CAMAROES CONGELADOS,01/12/1992,-
0303204,CENTOLAS CONGELADOS,01/12/1992,-
0303205,"""LOCOS"" CONGELADOS",01/12/1992,-
0303206,CARACOIS CONGELADOS,01/12/1992,-
0303299,OS DEMAIS CRUSTACEOS E MOLUSCOS (MESMO SEPAR,01/12/1992,-
0303301,"LAGOSTAS SECAS, SALGADAS OU EM SALMOURA",01/12/1992,-
0303302,"LAGOSTINS SECOS, SALGADOS OU EM SALMOURA",01/12/1992,-
0303399,OS DEMAIS CRUSTACEOS E MOLUSCOS (MESMO SEPAR,01/12/1992,-
0303901,CRUSTACEOS E MOLUSCOS PARA VIVEIROS,01/12/1992,-
0303902,FARINHA DE CRUSTACEOS PROPRIA PARA O CONSUMO,01/12/1992,-
0303999,OS DEMAIS CRUSTACEOS E MOLUSCOS (MESMO SEPAR,01/12/1992,-
0401101,"LEITE FRESCO, PASTEURIZADO OU NAO, OU ESTERI",01/12/1992,-
0401102,"LEITE PEPTONIZADO, HOMOGENEIZADO, MATERNIZAD",01/12/1992,-
0401199,"OS DEMAIS LEITES FRESCOS, NAO CONCENTRADOS N",01/12/1992,-
0401201,"CREME DE LEITE (NATA) FRESCO, PASTEURIZADO O",01/12/1992,-
0401202,"CREME DE LEITE (NATA), PEPTONIZADO, HOMOGENE",01/12/1992,-
0401299,"OS DEMAIS CREME DE LEITE (NATA) FRESCOS, NAO",01/12/1992,-
0402101,LEITE COM OU SEM ACUCAR (EXCETO O SORO) EM E,01/12/1992,-
0402109,OS DEMIAS LEITES COM OU SEM ACUCAR (EXCETO O,01/12/1992,-
0402111,LEITE COM OU SEM ACUCAR (EXCETO O SORO) EM E,01/12/1992,-
0402119,OS DEMAIS LEITES COM OU SEM ACUCAR (EXCETO O,01/12/1992,-
0402121,"LEITE COM OU SEM ACUCAR (EXCETO SORO), EM ES",01/12/1992,-
0402122,"LEITE COM OU SEM ACUCAR (EXCETO O SORO), EM",01/12/1992,-
0402129,OS DEMAIS LEITES COM OU SEM ACUCAR (EXCETO O,01/12/1992,-
0402131,"LEITE COM OU SEM ACUCAR (EXCETO O SORO), EM",01/12/1992,-
0402201,CREME DE LEITE (NATA) EM PO OU EM GRANULOS C,01/12/1992,-
0402202,CREME DE LEITE (NATA) APRESENTADO EM FORMA D,01/12/1992,-
0402301,"SORO DE LEITE (""LACTOSERUM"")",01/12/1992,-
0403001,"MANTEIGA (MANTEIGA DE LEITE DE VACA, MANTEIG",01/12/1992,-
0403002,"GORDURA DE MANTEIGA DESIDRATADA (""BUTTER-OIL",01/12/1992,-
0403099,AS DEMAIS MANTEIGAS,01/12/1992,-
0404101,"QUEIJO DE MASSA MOLE, TIPO COLONIA",01/12/1992,-
0404199,OS DEMAIS QUEIJOS DE MASSA MOLE,01/12/1992,-
0404201,"QUEIJO DE MASSA SEMIDURA, CHEDDAR (QUEIJO AM",01/12/1992,-
0404299,OS DEMAIS QUEIJOS DE MASSA SEMIDURA,01/12/1992,-
0404301,"QUEIJO DE MASSA DURA, PARMESAO",01/12/1992,-
0404302,"QUEIJO DE MASSA DURA, ROMANO",01/12/1992,-
0404399,OS DEMAIS QUEIJOS DE MASSA DURA,01/12/1992,-
0404401,QUEIJO TIPICO GORGONZOLA,01/12/1992,-
0404402,QUEIJO TIPICO ROQUEFORT OU AZUL,01/12/1992,-
0404499,OS DEMAIS QUEIJOS TIPICOS,01/12/1992,-
0404901,REQUEIJAO,01/12/1992,-
0404999,"OS DEMAIS QUEIJOS (EXCETOS OS DE MASSA MOLE,",01/12/1992,-
0405101,OVOS COM CASCA PARA REPRODUCAO,01/12/1992,-
0405102,OVOS COM CASCA PARA CONSUMO,01/12/1992,-
0405109,OS DEMAIS OVOS COM CASCA,01/12/1992,-
0405199,OS DEMAIS OVOS (SEM CASCA),01/12/1992,-
0405201,GEMAS DE OVOS,01/12/1992,-
0406001,MEL NATURAL,01/12/1992,-
0407001,"PRODUTOS COMESTIVEIS DE ORIGEM ANIMAL, NAO E",01/12/1992,-
0501001,CABELO LAVADO OU DESENGORDURADO,01/12/1992,-
0501002,RESIDUOS DE CABELO HUMANO,01/12/1992,-
0502101,CERDAS DE JAVALI,01/12/1992,-
0502102,CERDAS DE PORCO,01/12/1992,-
0502201,PELOS DE TEXUGO,01/12/1992,-
0502299,OS DEMAIS PELOS,01/12/1992,-
0502301,RESIDUOS DE CERDAS,01/12/1992,-
0502302,RESIDUOS DE PELOS,01/12/1992,-
0503101,CRINAS EM BRUTO (SIMPLESMENTE LAVADAS OU DES,01/12/1992,-
0503102,"CRINAS PREPARADAS (BRANQUEADAS, TINTAS, FRIS",01/12/1992,-
0503201,RESIDUOS DE CRINA,01/12/1992,-
0504101,"ESTOMAGOS (BUCHOS) INTEIROS OU EM PEDACOS, F",01/12/1992,-
0504102,"TRIPAS INTEIRAS OU EM BOCADOS, FRESCAS",01/12/1992,-
0504199,"AS DEMAIS BEXIGAS, INTEIRAS OU EM PEDACOS, F",01/12/1992,-
0504201,"ESTOMAGOS ( BUCHOS ) INTEIROS OU EM PEDACOS,",01/12/1992,-
0504202,"TRIPAS INTEIRAS OU EM PEDACOS, SALGADAS OU S",01/12/1992,-
0504299,"AS DEMAIS BEXIGAS INTEIRAS OU EM PEDACOS, SA",01/12/1992,-
0505001,RESIDUOS DE PEIXE,01/12/1992,-
0507101,"PELES E OUTRAS PARTES DE AVES, REVESTIDAS DE",01/12/1992,-
0507102,"PELES E PARTES DE PENAS (MESMO APARADAS), AS",01/12/1992,-
0507199,AS DEMAIS PELES E OUTRAS PARTES DE AVES  (TA,01/12/1992,-
0507201,"PENAS E PARTES DE PENAS (MESMO APARADAS), AS",01/12/1992,-
0507299,AS DEMAIS PENAS E PARTES DE PENAS (MESMO APA,01/12/1992,-
0507301,PO E RESIDUOS DE PENAS OU DE PARTES DE PENAS,01/12/1992,-
0508001,OSSOS E NUCLEOS CORNEOS,01/12/1992,-
0508002,FARINHA OU PO DE OSSOS,01/12/1992,-
0508099,"OS DEMAIS OSSOS E NUCLEOS CORNEOS (SABUGOS),",01/12/1992,-
0509101,MARFIM,01/12/1992,-
0509102,CARAPACA DE TARTARUGA,01/12/1992,-
0509103,"CHIFRES, PONTAS, CASCOS, UNHAS, GARRAS E BIC",01/12/1992,-
0509104,RESIDUOS E PO,01/12/1992,-
0509201,BARBATANAS DE BALEIA E DE ANIMAIS SEMELHANTE,01/12/1992,-
0512001,CORAL E SEMELHANTES,01/12/1992,-
0512002,CONCHAS,01/12/1992,-
0512099,OS DEMAIS,01/12/1992,-
0513001,ESPONJAS NATURAIS,01/12/1992,-
0514101,BILE,01/12/1992,-
0514102,HIPOFISE,01/12/1992,-
0514103,GLANDULAS MAMARIAS,01/12/1992,-
0514104,OVARIOS,01/12/1992,-
0514105,PANCREAS,01/12/1992,-
0514106,TESTICULOS,01/12/1992,-
0514107,TIROIDE,01/12/1992,-
0514108,VESICULAS,01/12/1992,-
0514109,CALCULOS BILIARES,01/12/1992,-
0514199,AS DEMAIS SUBSTANCIAS ANIMAIS UTILIZADAS NA,01/12/1992,-
0514901,AMBAR-CINZENTO,01/12/1992,-
0514902,ALMISCAR,01/12/1992,-
0514903,ALGALIA ( CIVETA ),01/12/1992,-
0514904,CASTOREO,01/12/1992,-
0514905,CANTARIDAS,01/12/1992,-
0514999,OS DEMAIS,01/12/1992,-
0515001,SANGUE,01/12/1992,-
0515002,COCHONILHA E OUTROS INSETOS SEMELHANTES,01/12/1992,-
0515003,SEMEN DE ANIMAIS,01/12/1992,-
0515004,"OVOS E OVAS DE PEIXE, NAO COMESTIVEIS",01/12/1992,-
0515005,OVOS DE BICHO-DA-SEDA,01/12/1992,-
0515006,ANIMAIS MORTOS IMPROPRIOS PARA A ALIMENTACAO,01/12/1992,-
0515007,TENDOES E NERVOS,01/12/1992,-
0515008,APARAS E OUTROS RESIDUOS SEMELHANTES DE PELE,01/12/1992,-
0515099,OS DEMAIS PRODUTOS ANIMAIS NAO ESPECIFICADOS,01/12/1992,-
0601001,"BULBOS, CEBOLAS, TUBERCULOS, RAIZES TUBEROSA",01/12/1992,-
0602001,PLANTAS E RAIZES,01/12/1992,-
0602002,"ESTACAS, ENXERTOS, CEPAS",01/12/1992,-
0602099,AS DEMAIS PLANTAS E RAIZES VIVAS,01/12/1992,-
0603001,"FLORES E BOTOES DE FLORES, CORTADOS PARA BUQ",01/12/1992,-
0603002,"FLORES E BOTOES DE FLORES CORTADOS, PARA BUQ",01/12/1992,-
0604001,"FOLHAGEM, FOLHAS E RAMOS E OUTRAS PARTES DE",01/12/1992,-
0604002,"FOLHAGEM, FOLHAS, RAMOS E OUTRAS PARTES DE P",01/12/1992,-
0701001,BATATAS PARA SEMEADURA FRESCAS OU REFRIGERAD,01/12/1992,-
0701002,BATATAS PARA CONSUMO FRESCAS OU REFRIGERADAS,01/12/1992,-
0701003,TOMATES FRESCOS OU REFRIGERADOS,01/12/1992,-
0701004,ALHOS FRESCOS OU REFRIGERADOS,01/12/1992,-
0701005,CEBOLAS FRESCAS OU REFRIGERADAS,01/12/1992,-
0701006,CENOURAS FRESCAS OU REFRIGERADAS,01/12/1992,-
0701007,"ECHALOTAS, PORROS E DEMAIS LEGUMES E HORTALI",01/12/1992,-
0701099,"OS DEMAIS LEGUMES E HORTALICAS, FRESCOS OU R",01/12/1992,-
0702001,"ERVILHAS COZIDAS OU NAO, CONGELADAS",01/12/1992,-
0702002,"ASPARGOS, COZIDOS OU NAO, CONGELADOS",01/12/1992,-
0702003,"ESPINAFRES COZIDOS OU SEM COZER, CONGELADOS",01/12/1992,-
0702004,"BETERRABA COZIDA OU SEM COZER, CONGELADA",01/12/1992,-
0702099,"OS DEMAIS LEGUMES E HORTALICAS, COZIDOS OU S",01/12/1992,-
0703001,"AZEITONAS, EM SALMOURA OU EM AGUA SULFURADA",01/12/1992,-
0703002,"ALCAPARRAS, EM SALMOURA OU EM AGUA SULFURADA",01/12/1992,-
0703003,"CEBOLAS, EM SALMOURA OU EM AGUA SULFURADAS O",01/12/1992,-
0703004,"PEPINOS, EM SALMOURA OU EM AGUA SULFURADA OU",01/12/1992,-
0703005,"TOMATES, EM SALMOURA OU EM AGUA SULFURADA OU",01/12/1992,-
0703006,"CENOURAS, EM SALMOURA OU EM AGUA SULFURADA O",01/12/1992,-
0703099,"OS DEMAIS LEGUMES E HORTALICAS, EM SALMOURA,",01/12/1992,-
0704001,ALHOS,01/12/1992,-
0704002,COGUMELOS,01/12/1992,-
0704099,"OS DEMAIS LEGUMES E HORTALICAS, DESSECADOS,",01/12/1992,-
0705101,ERVILHAS PARA SEMEADURA,01/12/1992,-
0705109,"AS DEMAIS ERVILHAS SECAS, INCLUSIVE AS DESCO",01/12/1992,-
0705111,GRAO-DE-BICO PARA SEMEADURA,01/12/1992,-
0705119,"OS DEMAIS GRAOS-DE-BICOS SECOS,INCLUSIVE OS",01/12/1992,-
0705121,LENTILHAS PARA SEMEADURA,01/12/1992,-
0705129,"AS DEMAIS LENTILHAS SECAS, INCLUSIVE AS DESC",01/12/1992,-
0705131,FEIJAO PARA SEMEADURA,01/12/1992,-
0705132,FEIJOES PRETOS,01/12/1992,-
0705139,"OS DEMAIS FEIJOES SECOS, INCLUSIVE OS DESCOR",01/12/1992,-
0705191,"OS DEMAIS GRAOS DE LEGUMINOSAS,SECOS DEBULHA",01/12/1992,-
0705199,"OS DEMAIS GRAOS DE LEGUMINOSAS, SECOS, DEBUL",01/12/1992,-
0706001,"RAIZES DE MANDIOCA, SECAS OU CORTADAS, EM PE",01/12/1992,-
0706002,"BATATA DOCE, SECA OU CORTADA EM PEDACOS",01/12/1992,-
0706099,"AS DEMAIS RAIZES, DE ARARUTA, DE SALEPO, TUP",01/12/1992,-
0801001,"TAMARAS, FRESCAS OU SECAS COM OU SEM CASCAS",01/12/1992,-
0801002,"BANANAS FRESCAS OU SECAS, COM OU SEM CASCAS",01/12/1992,-
0801003,ABACAXIS FRESCOS OU SECOS,01/12/1992,-
0801004,MANGAS E MANGOSTOES,01/12/1992,-
0801005,ABACATES FRESCOS OU SECOS,01/12/1992,-
0801006,GOIABAS FRESCAS OU SECAS,01/12/1992,-
0801007,COCOS FRESCOS OU SECOS,01/12/1992,-
0801008,CASTANHAS DO BRASIL (CASTANHAS-DO-PARA),01/12/1992,-
0801009,CASTANHAS DE CAJU (DE ACAJU OU DE ANACARDO),01/12/1992,-
0802001,LARANJAS FRESCAS OU SECAS,01/12/1992,-
0802002,"TANGERINAS E ""SATSUMAS""",01/12/1992,-
0802003,BERGAMOTA FRESCAS OU SECAS,01/12/1992,-
0802004,"MEXERICAS, WILKINGS E OUTROS HIBRIDOS SEMELH",01/12/1992,-
0802005,LIMOES E LIMAS,01/12/1992,-
0802006,"POMELOS (CITRUS PARADISI MACIF; ""GRAPE-FRUIT",01/12/1992,-
0802099,"AS DEMAIS FRUTAS CITRICAS, FRESCAS OU SECAS",01/12/1992,-
0803001,FIGOS FRESCOS,01/12/1992,-
0803002,FIGOS SECOS (PASSAS DE FIGOS),01/12/1992,-
0804001,UVAS,01/12/1992,-
0804002,PASSAS,01/12/1992,-
0805001,AMENDOAS,01/12/1992,-
0805002,AVELAS,01/12/1992,-
0805003,CASTANHAS,01/12/1992,-
0805004,NOZES COMUNS,01/12/1992,-
0805005,PINHOES,01/12/1992,-
0805099,AS DEMAIS FRUTAS FRESCAS OU SECAS,01/12/1992,-
0806001,MACAS FRESCAS,01/12/1992,-
0806002,PERAS FRESCAS,01/12/1992,-
0806003,MARMELOS FRESCOS,01/12/1992,-
0807001,CEREJAS FRESCAS,01/12/1992,-
0807002,AMEIXAS FRESCAS,01/12/1992,-
0807003,DAMASCOS FRESCOS,01/12/1992,-
0807004,"PESSEGOS (INCLUSIVE OS ""GRUNONES"", COM EXCLU",01/12/1992,-
0807005,"""NECTARINAS""",01/12/1992,-
0807099,"AS DEMAIS FRUTAS DE CAROCO, FRESCAS",01/12/1992,-
0808001,MORANGOS FRESCOS,01/12/1992,-
0808099,AS DEMAIS FRUTAS (BAGAS) FRESCAS,01/12/1992,-
0809001,MELOES FRESCOS,01/12/1992,-
0809002,MELANCIAS FRESCAS,01/12/1992,-
0809099,AS DEMAIS FRUTAS FRESCAS,01/12/1992,-
0810001,"CEREJAS (COZIDAS OU NAO), CONGELADAS, SEM AD",01/12/1992,-
0810002,"AMEIXAS (COZIDAS OU NAO), CONGELADAS, SEM AD",01/12/1992,-
0810003,"DAMASCOS (COZIDOS OU NAO), CONGELADOS, SEM A",01/12/1992,-
0810004,"MACAS (COZIDAS OU NAO), CONGELADAS, SEM ADIC",01/12/1992,-
0810005,"MELOES (COZIDOS OU NAO), CONGELADOS, SEM ADI",01/12/1992,-
0810006,"PERAS (COZIDAS OU NAO), CONGELADAS, SEM ADIC",01/12/1992,-
0810007,"MORANGOS COZIDOS OU NAO, CONGELADOS, SEM ADI",01/12/1992,-
0810099,"AS DEMAIS FRUTAS (COZIDAS OU NAO), CONGELADA",01/12/1992,-
0811001,"CEREJAS, EM SALMOURA, EM GAS SULFUROSO OU AG",01/12/1992,-
0811002,"DAMASCOS, EM SALMOURA, EM GAS SULFUROSO, OU",01/12/1992,-
0811003,"LARANJAS, EM SALMOURA, EM GAS SULFUROSO OU E",01/12/1992,-
0811004,"POLPAS DE FRUTAS, COZIDAS OU ESCALDADAS, APR",01/12/1992,-
0811005,FRUTAS SIMPLESMENTE TRATADAS EM SECO COM ANI,01/12/1992,-
0811099,AS DEMAIS FRUTAS CONSERVADAS TRANSITORIAMENT,01/12/1992,-
0812001,"CEREJAS (GINJAS), COM CAROCO",01/12/1992,-
0812002,"CEREJAS (GINJAS), SEM CAROCO",01/12/1992,-
0812003,"AMEIXAS, COM CAROCO",01/12/1992,-
0812004,"AMEIXAS, SEM CAROCO",01/12/1992,-
0812005,"DAMASCOS, COM CAROCO",01/12/1992,-
0812006,"DAMASCOS, SEM CAROCO",01/12/1992,-
0812007,"PESSEGOS, COM CAROCO",01/12/1992,-
0812008,"PESSEGOS, SEM CAROCO",01/12/1992,-
0812009,MACAS,01/12/1992,-
0812010,MARMELOS,01/12/1992,-
0812011,PERAS,01/12/1992,-
0812012,TAMARINDO,01/12/1992,-
0812013,MOSQUETA,01/12/1992,-
0812099,AS DEMAIS FRUTAS SECAS  (DIFERENTES  DAS  CO,01/12/1992,-
0813001,"CASCAS DE CITRICOS, FRESCAS, CONGELADAS, DES",01/12/1992,-
0813002,"CASCAS DE MELOES, FRESCAS, CONGELADAS, DESSE",01/12/1992,-
0901101,"CAFE CRU (CAFE VERDE, EM GRAO)",01/12/1992,-
0901102,"CAFE TORRADO, EM GRAO, EXCETO DESCAFEINADO",01/12/1992,-
0901103,"CAFE TORRADO MOIDO, EXCETO DESCAFEINADO",01/12/1992,-
0901104,"CAFE TORRADO, DESCAFEINADO",01/12/1992,-
0901199,OS DEMAIS TIPOS DE CAFE,01/12/1992,-
0901201,"SUCEDANEOS DO CAFE, CONTENDO CAFE EM QUALQUE",01/12/1992,-
0901301,CASCA E PELICULA DE CAFE,01/12/1992,-
0902001,"CHA A GRANEL, EM FOLHAS OU EM RECIPIENTES DE",01/12/1992,-
0902099,"CHA, EM OUTRAS FORMAS (SACOS, PASTILHAS, TAB",01/12/1992,-
0903001,ERVA-MATE CANCHEADA,01/12/1992,-
0903002,ERVA-MATE ELABORADA,01/12/1992,-
0903099,AS DEMAIS ERVA-MATE,01/12/1992,-
0904001,"PIMENTA (DO GENERO ""PIPER"")",01/12/1992,-
0904002,"PIMENTOS (DOS GENEROS ""CAPSICUM"" E PIMENTA)",01/12/1992,-
0904003,PIMENTOS DOCES MOIDOS OU PULVERIZADOS,01/12/1992,-
0905001,BAUNILHA,01/12/1992,-
0906001,CANELA E FLORES DE CANELA,01/12/1992,-
0907001,"CRAVO-DA-INDIA ( CRAVO-DE-CHEIRO ) (FRUTOS,",01/12/1992,-
0908001,NOZ-MOSCADA E MACIS,01/12/1992,-
0908099,"OS DEMAIS NOZ-MOSCADA, MACIS, AMOMOS E CARDA",01/12/1992,-
0909001,ANIS COMUM,01/12/1992,-
0909002,SEMENTES DE BADIANA,01/12/1992,-
0909003,SEMENTES DE COMINHO,01/12/1992,-
0909099,"AS DEMAIS SEMENTES DE FUNCHO, COENTRO, BADIA",01/12/1992,-
0910001,TIMO,01/12/1992,-
0910002,LOURO,01/12/1992,-
0910003,ACAFRAO,01/12/1992,-
0910004,GENGIBRE,01/12/1992,-
0910099,AS DEMAIS ESPECIARIAS,01/12/1992,-
1001101,TRIGO DURO,01/12/1992,-
1001199,OS DEMAIS TRIGO,01/12/1992,-
1001201,"MISTURA DE TRIGO COM CENTEIO (""MORCAJO"" OU """,01/12/1992,-
1002001,CENTEIO,01/12/1992,-
1003001,"CEVADA (INCLUSIVE AS VARIEDADES CHAMADAS ""NU",01/12/1992,-
1004001,AVEIA,01/12/1992,-
1005001,MILHO EM ESPIGA,01/12/1992,-
1005002,MILHO EM GRAO COM CASCA,01/12/1992,-
1005099,AS DEMAIS VARIEDADES DE MILHO,01/12/1992,-
1006001,ARROZ COM CASCA,01/12/1992,-
1006002,"ARROZ SEM CASCA, MAS SEM NENHUM PREPARO POST",01/12/1992,-
1006003,ARROZ POLIDO,01/12/1992,-
1006004,"ARROZ BRANQUEADO, EM PEROLA OU BRUNIDO",01/12/1992,-
1006005,ARROZ PARTIDO,01/12/1992,-
1006006,ARROZ ESTUFADO,01/12/1992,-
1006007,ARROZ CONVERTIDO,01/12/1992,-
1006099,OS DEMAIS TIPOS DE ARROZ,01/12/1992,-
1007001,MILHO PAINCO,01/12/1992,-
1007002,ALPISTA,01/12/1992,-
1007003,SORGO,01/12/1992,-
1007099,"OS DEMAIS CEREAIS; TRIGO MOURISCO, ETC",01/12/1992,-
1101001,FARINHA DE TRIGO OU DE MISTURA DE TRIGO  COM,01/12/1992,-
1101002,FARINHA DE AVEIA,01/12/1992,-
1101003,FARINHA DE CEVADA,01/12/1992,-
1101004,FARINHA DE CENTEIO,01/12/1992,-
1101005,FARINHA DE MILHO,01/12/1992,-
1101099,AS DEMAIS FARINHAS DE CEREAIS,01/12/1992,-
1102101,"""GRANONES"", SEMOLAS E AGLOMERADOS (""PELLETS""",01/12/1992,-
1102102,"""GRANONES"", SEMOLAS AGLOMERADOS (""PELLETS"")",01/12/1992,-
1102103,"""GRANONES"", SEMOLAS E AGLOMERADOS (""PELLETS""",01/12/1992,-
1102104,"""GRANONES"", SEMOLAS E AGLOMERADOS (""PELLETS""",01/12/1992,-
1102105,"""GRANONES"", SEMOLAS E AGLOMERADOS (""PELLETS""",01/12/1992,-
1102106,"""GRANONES"", SEMOLAS E AGLOMERADOS (""PELLETS""",01/12/1992,-
1102199,"OS DEMAIS ""GRANONES"", SEMOLAS E AGLOMERADOS",01/12/1992,-
1102201,AVEIA DESCASCADA,01/12/1992,-
1102202,AVEIA ESMAGADA,01/12/1992,-
1102209,AS DEMAIS AVEIAS,01/12/1992,-
1102211,CEVADA DESCASCADA,01/12/1992,-
1102212,CEVADA EM PEROLA,01/12/1992,-
1102219,AS DEMAIS CEVADAS,01/12/1992,-
1102221,MILHO DESCASCADO,01/12/1992,-
1102222,MILHO PILADO OU QUEBRADO,01/12/1992,-
1102229,OS DEMAIS TIPO DE MILHO,01/12/1992,-
1102299,"OS DEMAIS GRAOS DESCORTICADOS, EM PEROLAS, P",01/12/1992,-
1104101,FARINHA DE ERVILHAS,01/12/1992,-
1104102,FARINHA DE GRAO-DE-BICO,01/12/1992,-
1104103,FARINHA DE LENTILHAS,01/12/1992,-
1104104,FARINHA DE FEIJAO,01/12/1992,-
1104199,"AS DEMAIS FARINHAS DE LEGUMES, SECOS DA POSI",01/12/1992,-
1104201,FARINHA DE BANANA,01/12/1992,-
1104202,FARINHA DE NOZES OU CASTANHAS-DE-CAJU,01/12/1992,-
1104299,AS DEMAIS FARINHAS DAS FRUTAS CLASSIFICADAS,01/12/1992,-
1104301,FARINHAS E SEMOLAS DE SAGU,01/12/1992,-
1104302,FARINHAS E SEMOLAS DE MANDIOCA,01/12/1992,-
1104399,AS DEMAIS FARINHAS E SEMOLAS DAS RAIZES E TU,01/12/1992,-
1105001,FARINHAS DE BATATA,01/12/1992,-
1105002,SEMOLAS DE BATATA,01/12/1992,-
1105099,OS DEMAIS FLOCOS DE BATATAS,01/12/1992,-
1107001,"CEVADA MALTEADA EM GRAO, INCLUSIVE A CEVADA",01/12/1992,-
1107002,MALTE MOIDO,01/12/1992,-
1108101,AMIDO DE TRIGO,01/12/1992,-
1108102,AMIDO DE MILHO,01/12/1992,-
1108199,OS DEMAIS AMIDOS,01/12/1992,-
1108201,FECULAS DE BATATA,01/12/1992,-
1108299,AS DEMAIS FECULAS,01/12/1992,-
1108301,INULINA,01/12/1992,-
1109001,"GLUTEN DE TRIGO, MESMO SECO",01/12/1992,-
1201101,AMENDOIM PARA SEMEADURA,01/12/1992,-
1201102,AMENDOIM PARA OUTROS USOS,01/12/1992,-
1201201,COPRA,01/12/1992,-
1201301,NOZES DE PALMEIRA,01/12/1992,-
1201302,AMENDOAS DE PALMEIRA,01/12/1992,-
1201401,FAVAS DE SOJA PARA SEMEADURA,01/12/1992,-
1201402,FAVAS DE SOJA PARA OUTROS USOS,01/12/1992,-
1201501,SEMENTES DE LINHO (LINHACA) PARA SEMEADURA,01/12/1992,-
1201502,SEMENTES DE LINHO (LINHACA) PARA OUTROS USOS,01/12/1992,-
1201601,SEMENTES DE ALGODAO PARA SEMEADURA,01/12/1992,-
1201602,SEMENTES DE ALGODAO PARA OUTROS USOS,01/12/1992,-
1201701,SEMENTES DE MAMONA OU RICINO PARA SEMEADURA,01/12/1992,-
1201702,SEMENTES DE MAMONA OU RICINO PARA OUTROS USO,01/12/1992,-
1201901,SEMENTES DE BABACU PARA SEMEADURA,01/12/1992,-
1201902,SEMENTES DE BABACU PARA OUTROS USOS,01/12/1992,-
1201911,"SEMENTES DE CANHAMO (""CANNABIS SATIVA"") PARA",01/12/1992,-
1201912,"SEMENTES DE CANHAMO (""CANNABIS SATIVA"") PARA",01/12/1992,-
1201921,SEMENTES DE GIRASSOL PARA SEMEADURA,01/12/1992,-
1201922,SEMENTES DE GIRASSOL PARA OUTROS USOS,01/12/1992,-
1201931,SEMENTES DE URUCUM PARA SEMEADURA,01/12/1992,-
1201932,SEMENTES DE URUCUM PARA OUTROS USOS,01/12/1992,-
1201941,SEMENTES DE SESAMO (GERGELIM) PARA SEMEADURA,01/12/1992,-
1201942,SEMENTES DE SESAMO (GERGILIM) PARA OUTROS US,01/12/1992,-
1201951,SEMENTES DE NABO (NABILHA) E DE COLZA PARA S,01/12/1992,-
1201952,SEMENTES DE NABO (NABILHA) E DE COLZA PARA O,01/12/1992,-
1201991,"AS DEMAIS SEMENTES E FRUTOS OLEAGINOSOS, MES",01/12/1992,-
1201992,"AS DEMAIS SEMENTES E FRUTOS OLEAGINOSOS, MES",01/12/1992,-
1202001,"FARINHA DE GIRASSOL, SEM PREVIA EXTRACAO DE",01/12/1992,-
1202002,"FARINHA DE LINHO OU LINHACA, SEM PREVIA EXTR",01/12/1992,-
1202099,AS DEMAIS FARINHAS DE SEMENTES E DE FRUTOS O,01/12/1992,-
1203101,"SEMENTES, ESPOROS E FRUTOS DE ARVORES FRUTIF",01/12/1992,-
